"(父） ASIN","（子）ASIN","商品名称","买家访问次数","买家访问次数百分比","页面浏览次数","页面浏览次数百分比","购买按钮赢得率","已订购商品数量","订购数量 – B2B","订单商品数量转化率","商品转化率 – B2B","已订购商品销售额","已订购商品的销售额 – B2B","订单商品种类数","订单商品总数 – B2B"
"B07DPG3XWT","B002DL9M2G","Premier Dead Sea Luxurious Anti-aging Neck Cream, 2.04 oz","32","1.89%","39","1.84%","90%","5","1","15.63%","3.13%","US$196.05","US$39.21","5","1"
"B07DPF9KVS","B004H02GDI","Dead Sea Premier Beautifying Nail Kit Milk and Honey - Body Lotion,Cuticle Oil,Nail File,Buffing Block","79","4.66%","95","4.47%","92%","12","1","15.19%","1.27%","US$180.88","US$14.99","11","1"
"B07DZYZCFX","B000V7DONW","Dead Sea Premier Collagen, Beta-Carotene & Seaweed Mask","8","0.47%","11","0.52%","0%","0","0","0.00%","0.00%","US$0.00","US$0.00","0","0"
"B07DPF2HWG","B000VF5WVG","Premier by Dead Sea Premier Luxury Collection Milk Cleanser, 8.5 fl oz","62","3.66%","85","4.00%","44%","5","0","8.06%","0.00%","US$144.95","US$0.00","5","0"
"B0010BBCFK","B0010BBCFK","Premier Dead Sea Miracle Noir Mask, 2.04 Fluid Ounce","92","5.43%","123","5.79%","70%","7","0","7.61%","0.00%","US$284.86","US$0.00","7","0"
"B0010OMN4G","B0010OMN4G","Premier Dead Sea Shaving Cream for Men, Tube, 4.2268-Fluid Ounce","13","0.77%","19","0.89%","32%","0","0","0.00%","0.00%","US$0.00","US$0.00","0","0"
"B00115TXRE","B00115TXRE","Dead Sea Premier Eye Serum.","129","7.62%","177","8.33%","0%","0","0","0.00%","0.00%","US$0.00","US$0.00","0","0"
"B07DPF1KJW","B00117F5PG","Premier Dead Sea Vitamin Concentrated Facial Serum, Vitamin E and C, 1.7-Fluid Ounce","91","5.37%","106","4.99%","37%","2","0","2.20%","0.00%","US$129.18","US$0.00","2","0"
"B07DPGGY7T","B001278VEW","Premier Dead Sea Professional Peeling Mask","14","0.83%","16","0.75%","94%","0","0","0.00%","0.00%","US$0.00","US$0.00","0","0"
"B07DPF1NLN","B001561M00","Premier Dead Sea Intensive Biox Thermal Beauty Mask**NEW IN BOX**SAME IN MALL**","29","1.71%","33","1.55%","100%","0","0","0.00%","0.00%","US$0.00","US$0.00","0","0"
"B07DPDR6J4","B00157XFNQ","Premier Active Moisture Complex - Normal to Dry Skin","41","2.42%","52","2.45%","15%","7","0","17.07%","0.00%","US$278.43","US$0.00","4","0"
"B07DPFJV87","B00157ZFC0","Premier Dead Sea Body Butter Herbal Scent","4","0.24%","4","0.19%","100%","11","0","275.00%","0.00%","US$219.89","US$0.00","7","0"
"B00158196K","B00158196K","Premier Dead Sea Body Butter Passion Fruit Scent","22","1.30%","26","1.22%","100%","7","0","31.82%","0.00%","US$146.93","US$0.00","7","0"
"B0016Q1RI6","B0016Q1RI6","Premier Dead Sea Para-pharmaceutical Exfoliating Facial Gel, Brown, 4.25-Fluid Ounce","23","1.36%","28","1.32%","25%","1","0","4.35%","0.00%","US$25.69","US$0.00","1","0"
"B07DPDTHHN","B0016VW618","Premier Usa Dead Sea shaving Cream for Men All Skin","23","1.36%","31","1.46%","61%","7","0","30.43%","0.00%","US$110.33","US$0.00","6","0"
"B001DXOWA2","B001DXOWA2","Premier Dead Sea Ageless Future Cell Renewal Cream","14","0.83%","16","0.75%","100%","1","0","7.14%","0.00%","US$49.99","US$0.00","1","0"
"B001DXQDL8","B001DXQDL8","Premier Dead Sea Ageless Future Detoxifying Mask, All Skin Types, 2.04-Fluid Ounce","12","0.71%","14","0.66%","100%","0","0","0.00%","0.00%","US$0.00","US$0.00","0","0"
"B07DPGJQ3G","B002DV0KDQ","Premier Dead Sea Luxury Moisture Cream for Multi-Use","26","1.53%","30","1.41%","50%","5","0","19.23%","0.00%","US$88.95","US$0.00","5","0"
"B07DPFMP1Z","B002DYY35Y","Premier Dead Sea Mineral Body Treatment - Salt Scrub - Lemon Aroma","17","1.00%","22","1.04%","91%","5","0","29.41%","0.00%","US$86.95","US$0.00","5","0"
"B00383XLTS","B00383XLTS","Premier Dead Sea Biox Intensive Age Treatment Eye Cream Gel","22","1.30%","27","1.27%","0%","0","0","0.00%","0.00%","US$0.00","US$0.00","0","0"
"B00384AO7O","B00384AO7O","Dead Sea Premier Moisture Cream (for very dry & sensitive skin)","31","1.83%","43","2.02%","60%","0","0","0.00%","0.00%","US$0.00","US$0.00","0","0"
"B003NJKS48","B003NJKS48","Dead Sea Premier Luxury Milk Cleanser","8","0.47%","12","0.56%","83%","3","0","37.50%","0.00%","US$92.07","US$0.00","2","0"
"B07DPFQL49","B003Y7CMF2","Premier Dead Sea Instant Stretching and Revitalizing Lifting Mask - 2.04 oz Ounce","44","2.60%","60","2.82%","98%","3","0","6.82%","0.00%","US$115.77","US$0.00","3","0"
"B07DPDS1XR","B003Y7D0HQ","Premier Dead Sea Pearl White Cream Complex, 2.04-Fluid Ounce","24","1.42%","32","1.51%","9%","0","0","0.00%","0.00%","US$0.00","US$0.00","0","0"
"B003Y7EU16","B003Y7EU16","Premier Dead Sea Day Cream Complex (for normal to dry skin)","25","1.48%","36","1.69%","6%","0","0","0.00%","0.00%","US$0.00","US$0.00","0","0"
"B07DPD5NYY","B004H07KKC","Premier Dead Sea Skin Toner for Normal/Oily Skin, Pink, 8.4535-Fluid Ounce","15","0.89%","19","0.89%","100%","2","0","13.33%","0.00%","US$81.98","US$0.00","2","0"
"B004H09KEQ","B004H09KEQ","Premier Dead Sea Luxury Facial Cleanser with Micro Grains, 4.25-Fluid Ounce","51","3.01%","58","2.73%","0%","0","0","0.00%","0.00%","US$0.00","US$0.00","0","0"
"B004OEUPGM","B004OEUPGM","Exfoliating Body Scrub (Passion Fruit and Lime)","13","0.77%","18","0.85%","94%","1","0","7.69%","0.00%","US$32.89","US$0.00","1","0"
"B004OF47N8","B004OF47N8","Silky Body Butter (Apple, Green Tea, and Ginger)5.95 ounces","7","0.41%","10","0.47%","10%","1","0","14.29%","0.00%","US$9.50","US$0.00","1","0"
"B004OF9EPO","B004OF9EPO","Gratiae AHA Cleansing and Peeling Foam","35","2.07%","49","2.31%","39%","8","0","22.86%","0.00%","US$155.12","US$0.00","8","0"
"B004X9BTFY","B004X9BTFY","Gratiae Organics Exfoliating Body Scrub, Passion Fruit and Lime, 425-Grams","33","1.95%","44","2.07%","0%","0","0","0.00%","0.00%","US$0.00","US$0.00","0","0"
"B07DPHB3FD","B0052K03KA","Premier Dead Sea Essential Face Cleanser for Men","6","0.35%","8","0.38%","50%","6","0","100.00%","0.00%","US$69.54","US$0.00","5","0"
"B00BD3OU72","B00BD3OU72","Premier Dead Sea Para-pharmaceutical Exfoliating Facial Gel, Brown, 4.3958-Fluid Ounce","14","0.83%","21","0.99%","100%","5","0","35.71%","0.00%","US$128.45","US$0.00","5","0"
"B00G71LV3Q","B00G71LV3Q","Premier By Dead Sea Premier Refining Facial Peeling Mask 2.04oz, 60ml","66","3.90%","97","4.56%","0%","0","0","0.00%","0.00%","US$0.00","US$0.00","0","0"
"B07DPGL987","B01G3AIYJO","Gratiae Organic Beauty By Nature Exfoliating Body Scrub, Apple/Green Tea and Ginger by Gratiae Organic Beauty By Nature","24","1.42%","29","1.36%","41%","1","0","4.17%","0.00%","US$15.99","US$0.00","1","0"
"B01JSONMH6","B01JSONMH6","Gratiae Organic Beauty Renewing Peeling Gel","35","2.07%","44","2.07%","61%","3","0","8.57%","0.00%","US$140.97","US$0.00","3","0"
"B0761NM3BZ","B0761MXCJB","ZAIAI Women's Quilted Puffer Jacket Coat with Faux Fur Trimmed Hood Navy S","9","0.53%","9","0.42%","0%","0","0","0.00%","0.00%","US$0.00","US$0.00","0","0"
"B0761NM3BZ","B0761N286T","ZAIAI Women's Parka Winter Coat Overcoat Long Down Jacket Outwear Navy S","14","0.83%","15","0.71%","33%","0","0","0.00%","0.00%","US$0.00","US$0.00","0","0"
"B0761NM3BZ","B0761N3HJ3","Womens Hooded Warm Winter Faux Fur Lined Parkas Anoraks Long Coats Black XL","6","0.35%","6","0.28%","50%","0","0","0.00%","0.00%","US$0.00","US$0.00","0","0"
"B0761NM3BZ","B0761N46BN","ZAIAI Women's Coat with Fur Hood with 90% Down Parka Puffer Jacket Beige XL","13","0.77%","14","0.66%","86%","0","0","0.00%","0.00%","US$0.00","US$0.00","0","0"
"B0761NM3BZ","B0761NFQMT","ZAIAI Women's Anorak Parka Coat Silver Gray","12","0.71%","17","0.80%","0%","0","0","0.00%","0.00%","US$0.00","US$0.00","0","0"
"B0761NM3BZ","B0761NFTQC","ZAIAI Women's Coat with Fur Hood with 90% Down Parka Puffer Jacket Beige M","4","0.24%","5","0.24%","60%","0","0","0.00%","0.00%","US$0.00","US$0.00","0","0"
"B0761NM3BZ","B0761NGWJD","ZAIAI Women's Coat with Fur Hood with 90% Down Parka Puffer Jacket Black L","5","0.30%","6","0.28%","67%","0","0","0.00%","0.00%","US$0.00","US$0.00","0","0"
"B0761NM3BZ","B0761NGYTK","Womens Hooded Warm Coats Parkas With Fax Fur Jackets Navy XXL","24","1.42%","27","1.27%","93%","0","0","0.00%","0.00%","US$0.00","US$0.00","0","0"
"B0761NM3BZ","B0761NHB1Y","ZAIAI Women's Coat with Fur Hood with 90% Down Parka Puffer Jacket Beige XS","9","0.53%","9","0.42%","33%","0","0","0.00%","0.00%","US$0.00","US$0.00","0","0"
"B0761NM3BZ","B0761NJH9L","ZAIAI Women's Parka Winter Coat Overcoat Long Down Jacket Outwear Navy L","5","0.30%","6","0.28%","50%","0","0","0.00%","0.00%","US$0.00","US$0.00","0","0"
"B0761NM3BZ","B0761NJPNM","ZAIAI Women's Parka Winter Coat Overcoat Long Down Jacket Outwear Beige M","21","1.24%","26","1.22%","38%","0","0","0.00%","0.00%","US$0.00","US$0.00","0","0"
"B0761NM3BZ","B0761NM1NH","ZAIAI Womens Wool Jacket Coat Outwear Parka Overcoat Beige M","9","0.53%","9","0.42%","89%","0","0","0.00%","0.00%","US$0.00","US$0.00","0","0"
"B0761NM3BZ","B0761NM3BZ","ZAIAI Women's Polar Freeze Short Down Jacket Warm Winter Coat","58","3.42%","74","3.48%","0%","0","0","0.00%","0.00%","US$0.00","US$0.00","0","0"
"B0761NM3BZ","B0761NM3SZ","ZAIAI Women's Parka Winter Coat Overcoat Long Down Jacket Outwear Beige S","33","1.95%","41","1.93%","100%","1","0","3.03%","0.00%","US$42.49","US$0.00","1","0"
"B0761NM3BZ","B0761NMRB4","ZAIAI Women's Coat With Fur Hood With 90% Down Parka Puffer Jacket Black M","6","0.35%","7","0.33%","71%","0","0","0.00%","0.00%","US$0.00","US$0.00","0","0"
"B0761NM3BZ","B0761NNDWM","ZAIAI Women's Coat with Fur Hood with 90% Down Parka Puffer Jacket Black S","11","0.65%","13","0.61%","85%","0","0","0.00%","0.00%","US$0.00","US$0.00","0","0"
"B0761NM3BZ","B0761NNM84","ZAIAI Women's Parka Winter Coat Overcoat Long Down Jacket Outwear Beige XL","19","1.12%","19","0.89%","84%","0","0","0.00%","0.00%","US$0.00","US$0.00","0","0"
"B0761NM3BZ","B0761P4LK2","ZAIAI Women's Parka Winter Coat Overcoat Long Down Jacket Outwear Navy M","27","1.59%","34","1.60%","18%","0","0","0.00%","0.00%","US$0.00","US$0.00","0","0"
"B0761NM3BZ","B0761P4LKC","ZAIAI Women's Parka Winter Coat Overcoat Long Down Jacket Outwear Beige L","18","1.06%","19","0.89%","89%","0","0","0.00%","0.00%","US$0.00","US$0.00","0","0"
"B0761NM3BZ","B0761PBXCV","ZAIAI Women's Quilted Puffer Jacket Coat with Faux Fur Trimmed Hood Navy L","9","0.53%","12","0.56%","58%","0","0","0.00%","0.00%","US$0.00","US$0.00","0","0"
"B0761NM3BZ","B0761PDHV5","ZAIAI Women's Coat with Fur Hood with 90% Down Parka Puffer Jacket Black XS","4","0.24%","5","0.24%","80%","0","0","0.00%","0.00%","US$0.00","US$0.00","0","0"
"B0761NM3BZ","B0761PDMGN","ZAIAI Women's Parkas Anoraks Long Coats with Removable Faux Fur Trim Hood Black S","19","1.12%","23","1.08%","83%","0","0","0.00%","0.00%","US$0.00","US$0.00","0","0"
"B0761NM3BZ","B0761PL2N2","Womens Hooded Warm Coats Parkas With Fax Fur Jackets Navy S","11","0.65%","12","0.56%","83%","0","0","0.00%","0.00%","US$0.00","US$0.00","0","0"
"B0761NM3BZ","B0761PSPTJ","ZAIAI Women's Parkas Anoraks Long Coats with Removable Faux Fur Trim Hood Black L","7","0.41%","7","0.33%","57%","0","0","0.00%","0.00%","US$0.00","US$0.00","0","0"
"B0761NM3BZ","B0761PTZY2","ZAIAI Women's Parka Winter Coat Overcoat Long Down Jacket Outwear Beige XXL","16","0.94%","19","0.89%","42%","2","0","12.50%","0.00%","US$85.98","US$0.00","2","0"
"B0761NM3BZ","B0761PV952","ZAIAI Women's Coat With Fur Hood With 90% Down Parka Puffer Jacket Beige M","10","0.59%","12","0.56%","75%","0","0","0.00%","0.00%","US$0.00","US$0.00","0","0"
"B0761NM3BZ","B0761PVQYZ","ZAIAI Women's Parkas Anoraks Long Coats with Removable Faux Fur Trim Hood Black XL","9","0.53%","10","0.47%","90%","0","0","0.00%","0.00%","US$0.00","US$0.00","0","0"
"B0761NM3BZ","B0761PWB12","ZAIAI Women's Coat with Fur Hood with 90% Down Parka Puffer Jacket Beige L","6","0.35%","6","0.28%","50%","0","0","0.00%","0.00%","US$0.00","US$0.00","0","0"
"B0761NM3BZ","B0761PWSG1","ZAIAI Women's Parkas Anoraks Long Coats with Removable Faux Fur Trim Hood Black M","9","0.53%","10","0.47%","70%","0","0","0.00%","0.00%","US$0.00","US$0.00","0","0"
"B0761NM3BZ","B0761Q7KPX","ZAIAI Womens Wool Jacket Coat Outwear Parka Overcoat Beige XL","7","0.41%","7","0.33%","0%","0","0","0.00%","0.00%","US$0.00","US$0.00","0","0"
"B0761NM3BZ","B0761Q9VPH","ZAIAI Womens Wool Jacket Coat Outwear Parka Overcoat Beige S","12","0.71%","15","0.71%","67%","0","0","0.00%","0.00%","US$0.00","US$0.00","0","0"
"B0761NM3BZ","B0761QBHM9","ZAIAI Womens Hooded Warm Winter Faux Fur Lined Parkas Anoraks Long Coats Black M","5","0.30%","5","0.24%","0%","0","0","0.00%","0.00%","US$0.00","US$0.00","0","0"
"B0761NM3BZ","B0761QW2JK","ZAIAI Womens Wool Jacket Coat Outwear Parka Overcoat Beige XXL","11","0.65%","12","0.56%","75%","0","0","0.00%","0.00%","US$0.00","US$0.00","0","0"
"B0761NM3BZ","B0761R6ZG2","ZAIAI Women's Quilted Puffer Jacket Coat with Faux Fur Trimmed Hood Navy XS","11","0.65%","11","0.52%","100%","0","0","0.00%","0.00%","US$0.00","US$0.00","0","0"
"B0761NM3BZ","B0761R93J2","ZAIAI Womens Hooded Warm Winter Faux Fur Lined Parkas Anoraks Long Coats Black XXL","11","0.65%","13","0.61%","85%","0","0","0.00%","0.00%","US$0.00","US$0.00","0","0"
"B0761NM3BZ","B0761RRL7M","ZAIAI Womens Hooded Warm Coats Parkas With Fax Fur Jackets Navy XL","13","0.77%","13","0.61%","85%","0","0","0.00%","0.00%","US$0.00","US$0.00","0","0"
"B0761NM3BZ","B0761S2M63","ZAIAI Women's Quilted Puffer Jacket Coat with Faux Fur Trimmed Hood Navy M","6","0.35%","7","0.33%","43%","0","0","0.00%","0.00%","US$0.00","US$0.00","0","0"
"B0761NM3BZ","B0761S59N6","ZAIAI Womens Wool Jacket Coat Outwear Parka Overcoat Beige L","6","0.35%","6","0.28%","67%","0","0","0.00%","0.00%","US$0.00","US$0.00","0","0"
"B0761NM3BZ","B0761S8TXR","ZAIAI Womens Hooded Warm Winter Faux Fur Lined Parkas Anoraks Long Coats Black S","5","0.30%","5","0.24%","60%","1","0","20.00%","0.00%","US$38.80","US$0.00","1","0"
"B0761NM3BZ","B0761SKR3P","ZAIAI Women's Coat with Fur Hood with 90% Down Parka Puffer Jacket Black XL","12","0.71%","17","0.80%","59%","0","0","0.00%","0.00%","US$0.00","US$0.00","0","0"
"B0761NM3BZ","B0761V7L2R","ZAIAI Womens Hooded Warm Winter Faux Fur Lined Parkas Anoraks Long Coats Black L","8","0.47%","8","0.38%","75%","1","0","12.50%","0.00%","US$34.39","US$0.00","1","0"
