"(父） ASIN","（子）ASIN","商品名称","买家访问次数","买家访问次数百分比","页面浏览次数","页面浏览次数百分比","购买按钮赢得率","已订购商品数量","订单商品数量转化率","已订购商品销售额","订单商品种类数"
"B07CGCYBJK","B06XPKHVHC","Realistic Real Life Reborn Baby Dolls Girl Silicone Pink Outfit 22 Inches","813","5.85%","1,144","5.98%","100%","18","2.21%","US$1,619.82","18"
"B079JQCWQ6","B079JQCWQ6","Yesteria Real Looking Reborn Baby Dolls Girl Silicone Pink Outfit 22 Inches","879","6.33%","1,221","6.38%","100%","16","1.82%","US$1,471.84","16"
"B076K5GD3V","B074P4D14G","Reborn Baby Doll Outfits Girl Accessories for 20""- 22"" Pink","132","0.95%","208","1.09%","100%","13","9.85%","US$285.87","13"
"B079NYR8GC","B079NYR8GC","Silicone Reborn Baby Dolls Girl Look Real Lifelike Toddler White Outfit 16 Inches","235","1.69%","336","1.76%","100%","10","4.26%","US$799.90","10"
"B07BFVYCH2","B07BFVYCH2","Yesteria Silicone Reborn Baby Dolls Girl Look Real Lifelike Toddler Light Blue Rose Red Outfit with Toy Penguin 22 Inches","519","3.74%","661","3.45%","100%","8","1.54%","US$719.92","8"
"B07GQY3YGZ","B06XPJWWR4","Yesteria Reborn Baby Dolls Girl Look Real Silicone Pink Outfit 22 Inches","591","4.26%","817","4.27%","100%","7","1.18%","US$678.93","7"
"B076K5GD3V","B076K8YDNV","Reborn Baby Doll Outfits Girl Accessories for 20""- 22"" Pink and Cow Pattern","32","0.23%","44","0.23%","100%","7","21.88%","US$153.93","7"
"B076K5GD3V","B076KQB6X1","Reborn Baby Doll Outfits Girl Accessories for 20""- 22"" Rose Red and Cow Pattern","89","0.64%","115","0.60%","100%","7","7.87%","US$153.93","7"
"B07CM6R65H","B07CM6R65H","22 inches Full Silicone Body Reborn Baby Dolls Boy Hnadmade Toddler Eye Closed Red Outfit","625","4.50%","904","4.72%","100%","7","1.12%","US$699.93","7"
"B079JRPXZ8","B079JRPXZ8","Yesteria Real Life Silicone Reborn Baby Dolls Boy Look Real White Light Blue Outfit 22 Inches","462","3.33%","588","3.07%","100%","5","1.08%","US$449.95","5"
"B06XPJWWR4","B06XPJWWR4","Yesteria Reborn Baby Dolls Girl Look Real Silicone Pink Outfit 22 Inches","256","1.84%","360","1.88%","100%","4","1.56%","US$387.96","4"
"B076J6949M","B076J6949M","Realistic Sleeping Reborn Baby Doll Girl Lifelike Silicone Pink 22 Inches","425","3.06%","606","3.17%","100%","4","0.94%","US$359.96","4"
"B07CN76YH9","B07CN76YH9","22 Inches Real Looking Reborn Baby Dolls Girl Realistic Toddler Silicone Rose Red Outfit","196","1.41%","277","1.45%","100%","4","2.04%","US$359.96","4"
"B07D4DDT41","B07D4DDT41","24 inches Reborn Baby Doll Real Looking Toddler Blue Jacket with Crocodile Striped Pants White Shoes","93","0.67%","158","0.83%","99%","4","4.30%","US$435.96","4"
"B076J2TBNG","B076J2TBNG","Yesteria Real Looking Sleeping Reborn Baby Doll Girl Silicone Pink 22 Inches","292","2.10%","407","2.13%","99%","3","1.03%","US$269.97","3"
"B07D7V6HXN","B076J4L24W","Sleeping Reborn Baby Doll Girl Look Real Silicone Pink with Cow Pattern 22 Inches","42","0.30%","69","0.36%","100%","3","7.14%","US$269.97","3"
"B0792VG6VZ","B0792VG6VZ","Yesteria Reborn Baby Dolls Boy Lifelike Toddler Silicone Vinyl Blue Baby Jumpsuit 18 Inches","61","0.44%","89","0.47%","100%","3","4.92%","US$269.97","3"
"B0792VZN9S","B0792VZN9S","Real Life Reborn Baby Dolls Boy Baseball Sport Style White and Blue Outfit 22 inches","219","1.58%","295","1.54%","100%","3","1.37%","US$269.97","3"
"B079JWNR6Z","B079JWNR6Z","Yesteria Cheap Reborn Baby Dolls Silicone Full Body Girl Elephant Outfit 10 Inches","49","0.35%","59","0.31%","100%","3","6.12%","US$104.97","3"
"B07BNCFZXN","B07BNCFZXN","Reborn Baby Dolls Girl Full Silicone Body Look Real Rose Red Tutu Skirt 22 inches","147","1.06%","194","1.01%","100%","3","2.04%","US$298.80","3"
"B07CM58KHK","B07CM58KHK","20 Inches Full Silicone Body Reborn Baby Dolls Girl Handmade Toddler Eye Closed Pink Outfit","202","1.45%","319","1.67%","100%","3","1.49%","US$299.97","3"
"B07D4DRFYN","B07D4DRFYN","24 inches Realistic Reborn Baby Doll Girl Silicone Pink Outfit White Shoes with Toy Giraffe","206","1.48%","286","1.49%","100%","3","1.46%","US$326.97","3"
"B07DL5ZGP8","B07DL5ZGP8","10 inches Full Silicone Mini Palm Reborn Baby Doll Look Real Girl Toddler Eye Closed White Dress Flower Hair Band","210","1.51%","306","1.60%","100%","3","1.43%","US$98.97","3"
"B077SDPC6N","B077SDPC6N","Reborn Baby Doll Girl Look Real Silicone Denim Dress 22 Inches","153","1.10%","194","1.01%","99%","2","1.31%","US$179.20","2"
"B076K5GD3V","B077T29TYP","Reborn Baby Doll Outfits Girl Accessories for 20""- 22"" White and Cow Pattern","40","0.29%","54","0.28%","100%","2","5.00%","US$43.98","2"
"B07CGBF9HZ","B078XBDF6J","Real Looking Reborn Baby Dolls Twins Boy Silicone Light Blue 22 inches","239","1.72%","341","1.78%","100%","2","0.84%","US$179.98","2"
"B079JRG1TM","B079JRG1TM","","24","0.17%","32","0.17%","97%","2","8.33%","US$159.98","2"
"B079P24VZF","B079P24VZF","Sleeping Reborn Baby Dolls Girls Lifelike Toddler Silicone Pink Outfit with Cat Pattern 22 inches","135","0.97%","207","1.08%","100%","2","1.48%","US$139.98","2"
"B07CM664M7","B07CM664M7","20 inches Real Looking Reborn Baby Dolls Girl Silicone Vinyl Eye Closed Pink Pajama","308","2.22%","429","2.24%","100%","2","0.65%","US$171.98","2"
"B07CM67KDW","B07CM67KDW","20 inches Full Silicone Vinyl Body Reborn Baby Dolls Boy Real Looking Naked Toddler with Blue Blanket","75","0.54%","101","0.53%","100%","2","2.67%","US$213.98","2"
"B07F71667Y","B07F71667Y","Yesteria Realistic Reborn Baby Doll Girl Newborn Toddler Pink Princess Dress 24 inches","71","0.51%","103","0.54%","100%","2","2.82%","US$237.98","2"
"B076J5RSFF","B076J5RSFF","Reborn Baby Doll Boy Look Real Silicone Blue Outfit 22 inches","75","0.54%","111","0.58%","99%","1","1.33%","US$89.99","1"
"B076P99TGC","B076P99TGC","Yesteria Sleeping Reborn Baby Doll Boy Look Real Full Silicone Body Red Outfit 22 Inches","158","1.14%","194","1.01%","100%","1","0.63%","US$99.99","1"
"B076Q5PFD1","B076PDDZW9","Full Body Silicone African American Sleeping Reborn Baby Dolls Boy Look Real White Outfit 10 inches","55","0.40%","76","0.40%","99%","1","1.82%","US$26.99","1"
"B076Q7SNQ9","B076Q71HXL","Full Silicone Body Sleeping Reborn Baby Doll Twins Boy Look Real Light Blue Outfit 11 inches","68","0.49%","80","0.42%","100%","1","1.47%","US$29.99","1"
"B077YXYVGX","B077Z474QH","","13","0.09%","16","0.08%","81%","1","7.69%","US$12.99","1"
"B078X59HSZ","B078X59HSZ","African American Reborn Baby Dolls Girl Look Real Light Purple Outfit 22 Inches","133","0.96%","182","0.95%","100%","1","0.75%","US$89.99","1"
"B07B8ZP35L","B078Y2G7XW","Reborn Baby Dolls Full Silicone Body Real Looking Eye Closed Pink Outfit Small 10 inches","33","0.24%","52","0.27%","100%","1","3.03%","US$32.99","1"
"B0792BKMP5","B07929YDZM","Yesteria Full Silicone Body Reborn Baby Dolls Girl Look Real Pink Knitted Outfit 18 inches","141","1.02%","227","1.19%","100%","1","0.71%","US$99.60","1"
"B0794Z23LW","B0794Z23LW","Reborn Baby Dolls Girl Lifelike Toddler Silicone Vinyl Pink Outfit 22 Inches","61","0.44%","73","0.38%","100%","1","1.64%","US$69.99","1"
"B0795M8J8G","B0795M8J8G","Reborn Baby Dolls Girl Look Real Lifelike Toddler Silicone Vinyl Light Pink Dress 16 Inches","157","1.13%","215","1.12%","100%","1","0.64%","US$79.99","1"
"B0795M8ZGB","B0795M8ZGB","Reborn Baby Dolls Girl Look Real Lifelike Toddler Silicone Vinyl Light Pink Outfit 22 Inches","64","0.46%","87","0.45%","100%","1","1.56%","US$79.99","1"
"B0795QK1TP","B0795QK1TP","Reborn Baby Dolls Boy Lifelike Toddler Silicone Vinyl Light Blue Outfit 18 Inches","148","1.07%","182","0.95%","100%","1","0.68%","US$84.99","1"
"B079DRCQ6B","B079DRCQ6B","Sleeping Reborn Baby Dolls Girl Half Silicone Vinyl Body Look Real Lifelike Toddler White Baby Jumpsuit 22 inches","426","3.07%","604","3.16%","100%","1","0.23%","US$104.99","1"
"B079JQDDN7","B079JQDDN7","Silicone Reborn Baby Dolls Girl Look Real Eye Closed Pink Outfit 22 Inches","417","3.00%","617","3.22%","100%","1","0.24%","US$85.99","1"
"B079JQGCBR","B079JQGCBR","Black Full Body Silicone Reborn Baby Dolls Boy Cheap White Outfit 10 inches","59","0.42%","76","0.40%","100%","1","1.69%","US$23.99","1"
"B079JRDT89","B079JRDT89","Yesteria Silicone Reborn Baby Dolls Girl Look Real Eye Closed Pink Outfit 22 Inches","16","0.12%","23","0.12%","100%","1","6.25%","US$88.99","1"
"B079JXQJSM","B079JXQJSM","Silicone Reborn Baby Dolls Girl Look Real Denim Dress 22 Inches","189","1.36%","279","1.46%","97%","1","0.53%","US$87.99","1"
"B076K5GD3V","B079NX5R9C","Reborn Baby Doll Outfits Boy Accessories for 20""- 22"" Light Blue Outfit","38","0.27%","53","0.28%","100%","1","2.63%","US$21.99","1"
"B076K5GD3V","B079NXJZ52","Reborn Baby Doll Outfits Boy Accessories for 20""- 22"" White and Light Blue Pants","26","0.19%","34","0.18%","94%","1","3.85%","US$21.99","1"
"B079NY4SZ4","B079NY4SZ4","Realistic Reborn Baby Dolls Girl Eye Closed with Toy Bear Tutu Skirt Light Purple 22 inches","15","0.11%","21","0.11%","95%","1","6.67%","US$99.99","1"
"B079P52R76","B079P52R76","Reborn Baby Dolls Girl Look Real Lifelike Toddler with Toy Rabbit White and Light Gray Outfit 22 inches","16","0.12%","23","0.12%","100%","1","6.25%","US$89.99","1"
"B076K5GD3V","B079P55XYW","Reborn Baby Doll Outfits Boy Accessories for 20""- 22"" Pink Outfit","19","0.14%","28","0.15%","96%","1","5.26%","US$21.99","1"
"B07B9Q4R5Q","B07B94LQJR","Cheap Silicone Reborn Baby Dolls Look Real Boy White Outfit with Bee 10 Inches","44","0.32%","59","0.31%","100%","1","2.27%","US$32.99","1"
"B07B9C9WPT","B07B9C9WPT","Silicone Reborn Baby Dolls Boy Whte Outfit with Penguin Pattern 22 inches","48","0.35%","65","0.34%","100%","1","2.08%","US$89.99","1"
"B07B94SWTK","B07B9Q9YNG","Silicone Reborn Baby Dolls Look Real Girl Knitted Outfit Red 10 Inches","49","0.35%","58","0.30%","100%","1","2.04%","US$32.99","1"
"B07BDDC5WH","B07BDDC5WH","Full Silicone Body Reborn Baby Doll Boy Light Blue Outfit with Hippo Pattern 22 inches","44","0.32%","55","0.29%","100%","1","2.27%","US$99.99","1"
"B07BFVF3GM","B07BFVF3GM","Reborn Baby Dolls Girl Look Real Lifelike Toddler with Toy Chicken and Cushion White Baby Jumpsuit White Outfit 16 inches","120","0.86%","191","1.00%","100%","1","0.83%","US$85.99","1"
"B07BFVWTFR","B07BFVHDDP","Full Silicone Reborn Baby Dolls Twins Boy Realistic Toddler Light Gray Outfit with Dinosaur Patterns 20 inches","33","0.24%","44","0.23%","100%","1","3.03%","US$99.99","1"
"B07BFVWCV4","B07BFVWCV4","Realistic Reborn Baby Dolls Boy Toddler Blue Outfit with Rhino Patterns 22 inches","121","0.87%","168","0.88%","100%","1","0.83%","US$89.99","1"
"B07BLVVHBC","B07BLVB7FH","Soft Silicone Reborn Baby Dolls Boy Look Real Light Blue Outfit 16 inches","181","1.30%","273","1.43%","100%","1","0.55%","US$79.99","1"
"B07BSN65PZ","B07BSN65PZ","Reborn Baby Dolls Girl Look Real Lifelike Toddler Silicone with Toy Watermelon Red Outfit 16 inches","79","0.57%","114","0.60%","100%","1","1.27%","US$79.99","1"
"B07CM9N213","B07CM9N213","Yesteria 22 Inches Silicone Reborn Baby Dolls Girl Look Real Rose Red Tutu Skirt with Striped Pants","172","1.24%","228","1.19%","100%","1","0.58%","US$92.99","1"
"B07CN274MC","B07CN274MC","22 inches Full Silicone Body Reborn Baby Dolls Girl Real Looking Toddler Tutu Skirt","50","0.36%","61","0.32%","100%","1","2.00%","US$99.99","1"
"B07D4D4876","B07D4D4876","Real Looking Reborn Baby Doll Realistic Toddler Silicone Baseball Jacket White Pants White Shoes 24 inches","113","0.81%","153","0.80%","100%","1","0.88%","US$108.99","1"
"B07D4D6Q9C","B07D4D6Q9C","Yesteria 24 inches Realistic Reborn Baby Doll Silicone Monkey Coat Blue Pants White Shoes","33","0.24%","44","0.23%","100%","1","3.03%","US$108.99","1"
"B07D4DC72D","B07D4DC72D","24 inches Reborn Baby Doll Silicone Vinyl Realistic Toddler Panda Coat Black Pants with Shoes","26","0.19%","37","0.19%","100%","1","3.85%","US$108.99","1"
"B07FD9B9Q1","B07FD9B9Q1","Full Silicone Body Realistic Reborn Baby Doll Girl Pink Outfit with Toy Rabbit 24 Inches","25","0.18%","35","0.18%","97%","1","4.00%","US$99.90","1"
"B07FDK9WRH","B07FDCRR6Q","Reborn Baby Doll Outfits Girl Accessories for 20""- 22"" White and Black Zebra Pattern","30","0.22%","40","0.21%","100%","1","3.33%","US$23.99","1"
"B07GQY3YGZ","B07FYGT2PC","Life Like Reborn Baby Dolls Girl Pink and White Outfit Blonde Curls 22 inches","42","0.30%","51","0.27%","100%","1","2.38%","US$89.99","1"
"B076J2H7FC","B076J2H7FC","Reborn Baby Doll Wig Baby Girl Look Real Silicone Pink 22 Inches","87","0.63%","109","0.57%","100%","0","0.00%","US$0.00","0"
"B07DW3PG13","B076MVRP3M","Reborn Baby Doll Boy Look Real Full Silicone Body Light Blue Outfit 10 Inches","3","0.02%","6","0.03%","100%","0","0.00%","US$0.00","0"
"B07DW3PG13","B076MW1Y4F","Yesteria Sleeping Reborn Baby Doll Girl Look Real Silicone Pink Outfit 22 Inches","14","0.10%","16","0.08%","94%","0","0.00%","US$0.00","0"
"B076Q5PFD1","B076Q7DCP1","Full Body Silicone African American Sleeping Reborn Baby Dolls Girl Look Real Pink Outfit 10 inches","67","0.48%","91","0.48%","100%","0","0.00%","US$0.00","0"
"B078RKMTYD","B077HNP6TL","Slicone Vinyl Body Reborn Baby Doll Elephant Outfit Look Real Gray 10 inches","79","0.57%","109","0.57%","100%","0","0.00%","US$0.00","0"
"B077SGXYL6","B077SGXYL6","Reborn Baby Doll Girl Look Real Silicone Pink Tutu Skirt 22 Inches","35","0.25%","38","0.20%","95%","0","0.00%","US$0.00","0"
"B077SHDMC8","B077SHDMC8","Reborn Baby Dolls Boy Look Real White and Light Blue Outfit Crocodile Patterns 22 Inches","10","0.07%","10","0.05%","100%","0","0.00%","US$0.00","0"
"B077SNDT1X","B077SNDT1X","Reborn Baby Doll Boy Look Real Silicone Blue Outfit with Car Pattern 22 Inches","7","0.05%","8","0.04%","100%","0","0.00%","US$0.00","0"
"B077VNWLJW","B077VNWLJW","4 Pcs Reborn Baby Doll Supplies Accessories Magnet Dummy Pacifier Transparent Blue Green Pink","4","0.03%","5","0.03%","40%","0","0.00%","US$0.00","0"
"B0784T23ZQ","B0784T23ZQ","Real Looking Reborn Baby Doll Boy Light Blue Outfit with Hippo Pattern 22 Inches","27","0.19%","34","0.18%","100%","0","0.00%","US$0.00","0"
"B0788N9R3H","B0788N9R3H","Realistic Reborn Baby Doll Girl Silicone Vinyl Rose Red Tutu Skirt 22 Inches","7","0.05%","8","0.04%","88%","0","0.00%","US$0.00","0"
"B0788NF4TB","B0788NF4TB","African American Reborn Baby Doll Boy Look Real Full Silicone Body Bohemia Style Orange Outfit 10 Inches","8","0.06%","8","0.04%","88%","0","0.00%","US$0.00","0"
"B07CJHY4JT","B0788P8DCG","African American Reborn Baby Doll Girl Look Real Full Silicone Body Bohemia Style Dress 10 Inches","14","0.10%","15","0.08%","100%","0","0.00%","US$0.00","0"
"B078X5DJLB","B078X5DJLB","Realistic Reborn Baby Dolls Girl Look Real Toddler Silicone Light Purple Outfit with Cushion 16 Inches","137","0.99%","180","0.94%","100%","0","0.00%","US$0.00","0"
"B078X5DZRT","B078X5DZRT","Sleeping Silicone Reborn Baby Dolls Boy Look Real Light Gray Outfit 22 Inches","29","0.21%","38","0.20%","100%","0","0.00%","US$0.00","0"
"B078X5HG51","B078X5HG51","Reborn Baby Doll Girl Look Real Rose Red Tutu Skirt 22 Inches","5","0.04%","6","0.03%","100%","0","0.00%","US$0.00","0"
"B078XB1WC9","B078XB1WC9","Silicone Reborn Baby Dolls Girl Look Real Eye Closed Pink Outfit 22 inches","20","0.14%","24","0.13%","100%","0","0.00%","US$0.00","0"
"B07CGBF9HZ","B078XBY1MZ","Real Looking Sleeping Reborn Baby Dolls Twins Girl Silicone Pink 22 inches","38","0.27%","45","0.24%","100%","0","0.00%","US$0.00","0"
"B07B91NK9X","B078XZR24D","African American Reborn Baby Dolls Full Silicone Body Real Looking Eye Closed Pink Outfit Small 10 inches","15","0.11%","17","0.09%","100%","0","0.00%","US$0.00","0"
"B07B8YB42P","B078XZRP4X","African American Reborn Baby Dolls Full Silicone Body Bohemia Outfit Boy Black 10 inches","6","0.04%","7","0.04%","71%","0","0.00%","US$0.00","0"
"B07B8ZP35L","B078Y5BTZC","Reborn Baby Dolls Full Silicone Body Real Looking Eye Closed Light Blue Outfit Small 10 inches","50","0.36%","67","0.35%","99%","0","0.00%","US$0.00","0"
"B0792VHP6W","B0792VHP6W","Sleeping Reborn Baby Dolls Boy Look Real Stripe Outfit with Panda Pattern 20 inches","19","0.14%","28","0.15%","100%","0","0.00%","US$0.00","0"
"B0792VKCCR","B0792VKCCR","Yesteria Sleeping Reborn Baby Dolls Boy Look Real Lifelike Toddler Silicone Vinyl Panda Outfit 18 Inches","107","0.77%","158","0.83%","100%","0","0.00%","US$0.00","0"
"B0792VRZ89","B0792VRZ89","Yesteria Reborn Baby Dolls Boy Look Real Silicone Grey Outfit 22 Inches","34","0.24%","44","0.23%","100%","0","0.00%","US$0.00","0"
"B07CJ9GLPY","B0793PS7QX","African American Reborn Baby Doll Boy Look Real Full Silicone Body Romper Vintage Style 10 Inches","13","0.09%","15","0.08%","100%","0","0.00%","US$0.00","0"
"B0793QLQ3Z","B0793QLQ3Z","African American Reborn Baby Dolls Curls Girl Real Looking Toddler Denim Dress 22 Inches","18","0.13%","25","0.13%","100%","0","0.00%","US$0.00","0"
"B07CJ9GLPY","B0793QZPK1","Full Silicone Body African American Reborn Baby Doll Girl Look Real Floral Dress Vintage Style 10 inches","60","0.43%","79","0.41%","100%","0","0.00%","US$0.00","0"
"B0793R99F1","B0793R99F1","Real Looking Reborn Baby Dolls Girl Silicone Light Purple Tutu Skirt 22 Inches","14","0.10%","19","0.10%","95%","0","0.00%","US$0.00","0"
"B0793RG3PM","B0793RG3PM","Real Life Silicone Reborn Baby Dolls Boy Look Real Striped Jumpsuit 22 Inches","234","1.69%","308","1.61%","100%","0","0.00%","US$0.00","0"
"B0793RW7P4","B0793RW7P4","Real Looking Reborn Baby Dolls Girl Silicone Rose Red Outfit 22 Inches","154","1.11%","232","1.21%","100%","0","0.00%","US$0.00","0"
"B07D7V6HXN","B0794XFL8V","Sleeping Reborn Baby Doll Girl Look Real Silicone Rose Red Outfit with Cow Pattern 15 inches","5","0.04%","5","0.03%","100%","0","0.00%","US$0.00","0"
"B07CGCYBJK","B0794ZPQ8B","Real Life Reborn Baby Doll Girl Silicone Pink Outfit 15 inches","56","0.40%","70","0.37%","100%","0","0.00%","US$0.00","0"
"B0795117ZD","B0795117ZD","Full Silicone Body Real Life Reborn Baby Dolls Boy Light Gray Outfit 22 Inches","47","0.34%","79","0.41%","99%","0","0.00%","US$0.00","0"
"B079513H1Q","B079513H1Q","Reborn Baby Dolls Boy Look Real Lifelike Toddler Silicone Vinyl Dots Outfit With Toy Bear 22 Inches","8","0.06%","9","0.05%","78%","0","0.00%","US$0.00","0"
"B078RKMTYD","B0795D6KPS","Reborn Baby Doll Girl Elephant Outfit Look Real Silicone Gray 16 Inches","12","0.09%","12","0.06%","100%","0","0.00%","US$0.00","0"
"B0795M2NML","B0795M2NML","Full Silicone Body Realistic Reborn Baby Dolls African Amrican Toddler with Curly Hair White Outfit 22 Inches","51","0.37%","68","0.36%","100%","0","0.00%","US$0.00","0"
"B0795PQJS1","B0795PQJS1","Reborn Baby Dolls Girl Look Real Lifelike Toddler Silicone Vinyl Light Pink Knitted Outfit 22 Inches","79","0.57%","98","0.51%","100%","0","0.00%","US$0.00","0"
"B078RKMTYD","B0795VRN2N","Real Looking Soft Silicone Reborn Baby Doll Bear Outfit Light Brown 17 Inches","13","0.09%","13","0.07%","100%","0","0.00%","US$0.00","0"
"B079DPVXXZ","B079DPVXXZ","Sleeping Reborn Baby Dolls Girl Half Silicone Vinyl Body Lifelike Toddler with Toy Bear Rose Red Outfit 22 inches","10","0.07%","14","0.07%","93%","0","0.00%","US$0.00","0"
"B07B8YB42P","B079K3D4WY","Cheap Full Silicone Reborn Baby Dolls Girl Bohemia Style Dress 10 Inches","29","0.21%","30","0.16%","100%","0","0.00%","US$0.00","0"
"B079M128Y6","B079M128Y6","Sleeping Silicone Reborn Baby Dolls Girl Look Real White Nightdress 20 inches","13","0.09%","13","0.07%","92%","0","0.00%","US$0.00","0"
"B079NSK8NL","B079NSK8NL","Realistic Reborn Baby Dolls Girl Toddler with Toy Bear Light Pink Outfit 22 Inches","5","0.04%","5","0.03%","40%","0","0.00%","US$0.00","0"
"B079NW9791","B079NW9791","Realistic Reborn Baby Dolls Boy Toddler with Toy Bear Blue Outfit 22 inches","68","0.49%","77","0.40%","99%","0","0.00%","US$0.00","0"
"B079NWXG5Z","B079NWXG5Z","Reborn Baby Dolls Girl Look Real Lifelike Toddler with Toy Giraffe Pink Outfit 22 inches","5","0.04%","5","0.03%","20%","0","0.00%","US$0.00","0"
"B076K5GD3V","B079P28VV3","Reborn Baby Doll Outfits Boy Accessories for 20""- 22"" Light Blue Outfit","12","0.09%","13","0.07%","92%","0","0.00%","US$0.00","0"
"B0792BKMP5","B07B7G22RT","Yesteria Full Silicone Body Reborn Baby Dolls Boy Look Real Light Blue Outfit 18 inches","36","0.26%","63","0.33%","100%","0","0.00%","US$0.00","0"
"B07B9Q4R5Q","B07B9Q774Z","Cheap Silicone Reborn Baby Dolls Look Real Girl Pink Outfit with Bee 10 Inches","16","0.12%","20","0.10%","90%","0","0.00%","US$0.00","0"
"B07B94SWTK","B07B9SLG9M","Silicone Reborn Baby Dolls Look Real Boy Knitted Outfit Green 10 Inches","13","0.09%","18","0.09%","100%","0","0.00%","US$0.00","0"
"B07BFVFDWC","B07BFV7XQM","Reborn Baby Dolls Twins Boy Lifelike Toddler Silicone Light Blue Outfit Giraffe Patterns 16 inches","10","0.07%","12","0.06%","100%","0","0.00%","US$0.00","0"
"B07BFVWTFR","B07BFVXKTL","Full Silicone Reborn Baby Dolls Twins Girl Realistic Toddler Pink Outfit 20 inches","10","0.07%","12","0.06%","100%","0","0.00%","US$0.00","0"
"B07BFVFDWC","B07BFVXXX8","Reborn Baby Dolls Twins Girl Lifelike Toddler Silicone Eye Closed Pink Outfit with Toy Bear 16 inches","16","0.12%","24","0.13%","79%","0","0.00%","US$0.00","0"
"B07BLRW9H6","B07BLRH5BR","Real Life Reborn Baby Dolls Boy Full Silicone Body Light Blue Outfit with Sleeping Bag 10 inches","21","0.15%","25","0.13%","100%","0","0.00%","US$0.00","0"
"B07BLRW9H6","B07BLRWT2V","Real Life Reborn Baby Dolls Girl Full Silicone Body Pink Outfit with Sleeping Bag 10 inches","12","0.09%","16","0.08%","100%","0","0.00%","US$0.00","0"
"B07BLVVHBC","B07BLTPG2G","Sleeping Soft Silicone Reborn Baby Dolls Girl Look Real Pink Outfit 16 inches","46","0.33%","51","0.27%","100%","0","0.00%","US$0.00","0"
"B07BRK2R83","B07BRK2R83","Yesteria Real Life Reborn Baby Dolls Girl Look Real Silicone Vinyl Pink Outfit 15 Inches","4","0.03%","4","0.02%","50%","0","0.00%","US$0.00","0"
"B07BSHY6ZL","B07BSHY6ZL","Full Silicone Body Sleeping Reborn Baby Dolls Girl Lifelike Toddler Rose Red Outfit 22 inches","114","0.82%","151","0.79%","100%","0","0.00%","US$0.00","0"
"B07CLYNY71","B07CLYNY71","20 inches Realistic Sleeping Reborn Baby Dolls Boy Silicone Vinyl Black and White Striped Outfit","23","0.17%","23","0.12%","100%","0","0.00%","US$0.00","0"
"B07CM347WF","B07CM347WF","22 inches Real Looking Reborn Baby Dolls Girl Realistic Toddler Silicone Vinyl Pink European Retro Nightdress","27","0.19%","39","0.20%","100%","0","0.00%","US$0.00","0"
"B07CM52CNC","B07CM52CNC","22 inches Real Looking Reborn Baby Dolls Girl Realistic Toddler Silicone Vinyl White European Retro Nightdress","8","0.06%","9","0.05%","78%","0","0.00%","US$0.00","0"
"B07CN4J157","B07CN4J157","16 inches Real Looking Reborn Baby Dolls Girl Realistic Toddler Silicone Cow Outfit","16","0.12%","18","0.09%","100%","0","0.00%","US$0.00","0"
"B07CN4J1B2","B07CN4J1B2","22 inches Realistic Reborn Baby Dolls Girl Silicone with Toy Cow","15","0.11%","16","0.08%","100%","0","0.00%","US$0.00","0"
"B07F72X354","B07F72X354","Yesteria Real Looking Reborn Baby Doll Girl Realistic Newborn Toddler Floral Princess Dress 24 inches","34","0.24%","47","0.25%","100%","0","0.00%","US$0.00","0"
"B07F73THXK","B07F73THXK","Yesteria Reborn Baby Doll Girl Look Real Newborn Toddler Plaid Princess Dress 24 inches","95","0.68%","125","0.65%","99%","0","0.00%","US$0.00","0"
"B07FD6C9T4","B07FD6C9T4","Real Looking Reborn Baby Doll African American Girl Realistic Newborn White Dress with Toy Bear 22 inches","7","0.05%","8","0.04%","88%","0","0.00%","US$0.00","0"
"B07FDCC8ZC","B07FDCC8ZC","Realistic Reborn Baby Doll Girl Silicone Newborn Pink Floral Dress 16 Inch","7","0.05%","7","0.04%","71%","0","0.00%","US$0.00","0"
"B07FDK9WRH","B07FDD4P8H","Reborn Baby Doll Outfits Accessories for 20""- 22"" Yellow Duck Pattern","17","0.12%","19","0.10%","100%","0","0.00%","US$0.00","0"
"B07FNJYWTX","B07FNJYWTX","Sleeping Real Looking Reborn Baby Doll Realistic Newborn Toddler Rabbit Pattern 18 inches","31","0.22%","36","0.19%","97%","0","0.00%","US$0.00","0"
"B07FNKS38N","B07FNKS38N","Realistic Reborn Baby Doll Girl Newborn Blue Outfit Bear Pattern 16 inches","22","0.16%","31","0.16%","100%","0","0.00%","US$0.00","0"
"B07FNL69J7","B07FNL69J7","Full Silicone Vinyl Body Realistic Reborn Baby Doll Boy with Panda Blanket 17 inches","84","0.60%","94","0.49%","100%","0","0.00%","US$0.00","0"
"B07GQY3YGZ","B07FYF8J1H","Reborn Baby Dolls Girl Look Real Pink and White Outfit Brown Curls 22 inches","41","0.30%","53","0.28%","100%","0","0.00%","US$0.00","0"
"B07G1Z8D76","B07G1Z8D76","Realistic Reborn Baby Doll Boy Silicone Vinyl Body Blue Outfit with Lovley Toy Bear 22 Inches","14","0.10%","16","0.08%","100%","0","0.00%","US$0.00","0"
"B07G2BPXQ7","B07G2BPXQ7","Realistic Reborn Baby Doll Real Life Soft Body Silicone Vinyl Blue Outfit 22 Inches","26","0.19%","35","0.18%","97%","0","0.00%","US$0.00","0"
"B07G41G2GB","B07G41G2GB","Realistic Reborn Baby Doll Girl Toddler Real Life Lovely Silicone Vinyl Green Outfit 24 inches","32","0.23%","45","0.24%","100%","0","0.00%","US$0.00","0"
"B07GDPF7DB","B07GDPF7DB","Real Looking Reborn Baby Doll Girl Realistic Toddler in Red Floral Dress Toy Bear 24 inch","2","0.01%","2","0.01%","50%","0","0.00%","US$0.00","0"
"B07GDQS6D2","B07GDQS6D2","Real Looking Reborn Baby Doll Girl Realistic Toddler Pink Outfit White Shoes with Toy Giraffe 24 inch","3","0.02%","3","0.02%","100%","0","0.00%","US$0.00","0"
